safegraph_place_id,location_name,top_category,sub_category,street_address,city,state,postal_code
sg:b7f32671db734ea69e92d73899eb68fe,Edward Jones,Other Financial Investment Activities,Miscellaneous Financial Investment Activities,501 Saint Vrain Ln Unit 202,Estes Park,CO,80517
sg:124397ddd0d94506a91d367eb365bc1a,Reel Mountain Theater,Motion Picture and Video Industries,Motion Picture Theaters (except Drive-Ins),543 Big Thompson Ave,Estes Park,CO,80517
sg:43a396c0aeb3403c8211e99941fd3862,Sasquatch Fly Fishing,Other Motor Vehicle Dealers,Boat Dealers,2515 Tunnel Rd,Estes Park,CO,80511
sg:6bc3ab2a71034692b9213d9ac05c86d6,Redrum Tattoo &amp Piercing Co,Personal Care Services,Other Personal Care Services,157 W Elkhorn Ave,Estes Park,CO,80517
sg:be4ecf036eb5470f8aa575829024a324,Fun City,Amusement Parks and Arcades,Amusement and Theme Parks,455 Prospect Village Dr,Estes Park,CO,80517
sg:6dc2116dbdf54d8cb61f55cdcd55c2a4,Estes Park Dept of Revenue,Administration of Economic Programs,Regulation and Administration of Transportation Programs,1601 Brodie Ave,Estes Park,CO,80517
sg:368e88db01294f96af0b37b3ce7a9279,Beef Jerky Outlet Estes Park,Grocery Stores,Supermarkets and Other Grocery (except Convenience) Stores,131 Virginia Dr,Estes Park,CO,80517
sg:48b027cd29d449f89d52bd7c4d514f28,Rocky Mountain Rush,Restaurants and Other Eating Places,Snack and Nonalcoholic Beverage Bars,212 E Elkhorn Ave,Estes Park,CO,80517
sg:a6e520f0b9044a5d9f692ffc28d86436,Lake Estes Marina,Other Motor Vehicle Dealers,Boat Dealers,1770 Big Thompson Ave,Estes Park,CO,80517
sg:8313223d82b24a08b63092d922fb158a,Javier Gomez Re Max Mountain Brokers,Offices of Real Estate Agents and Brokers,Offices of Real Estate Agents and Brokers,1200 Graves Ave,Estes Park,CO,80517
sg:fd1e29652ff24a73abbee9b73caf9663,Estes Valley Collision,Automotive Repair and Maintenance,"Automotive Body, Paint, and Interior Repair and Maintenance",611 Lone Pine Dr,Estes Park,CO,80517
sg:cdf1b99b666f4eb8806e00fbcf59242c,Parlour Salon and Spa,Personal Care Services,Beauty Salons,Stanley Hotel 333 E Wonderview Ave,Estes Park,CO,80517
sg:1c4f8775e141410f8d76dfc5769ebf51,Tiny Town Cabins,Traveler Accommodation,Hotels (except Casino Hotels) and Motels,830 Moraine Ave,Estes Park,CO,80517
sg:dce0420a1a7b45b298600bcbc9739876,Rocky Mountain Knife,"Sporting Goods, Hobby, and Musical Instrument Stores",Sporting Goods Stores,125 Moraine Ave,Estes Park,CO,80517
sg:a79f696a5dc54c17979919fb01537643,Casa Grande Mexican Restaurant,Restaurants and Other Eating Places,Full-Service Restaurants,210 E Elkhorn Ave,Estes Park,CO,80517
sg:0438c555240e4b53b386fb8b04fb0c27,Cabin Fever,"Jewelry, Luggage, and Leather Goods Stores",Jewelry Stores,213 W Elkhorn Ave,Estes Park,CO,80517
sg:321997719dda4f7cb0c1baf434eb3558,Dad's Maytag Laundry,Drycleaning and Laundry Services,Drycleaning and Laundry Services (except Coin-Operated),457 E Wonder View Ave,Estes Park,CO,80517
sg:5c76271746894b759767d8b5cb14da5d,Dog & Agility Park,"Museums, Historical Sites, and Similar Institutions",Nature Parks and Other Similar Institutions,380 Community Dr,Estes Park,CO,80517
sg:232f334f6af14285bd2c7f2b17e64742,Himalayan Curry & Kebob,Restaurants and Other Eating Places,Full-Service Restaurants,101 Elkhorn Ave,Estes Park,CO,80517
sg:827b56d546e24ca183f75b3787535cca,Lumpy Ridge Brewing Co,Beverage Manufacturing,Breweries,531 S Saint Vrain Ave,Estes Park,CO,80517
sg:dfe4154a00e24a6495bafc3258a9b71d,The Ore Cart Rock Shop,"Jewelry, Luggage, and Leather Goods Stores",Jewelry Stores,119 W Elkhorn Ave,Estes Park,CO,80517
sg:f3ed31f4f65d486faa58e31492c1dc0f,7522 Automotive,"Automotive Parts, Accessories, and Tire Stores",Automotive Parts and Accessories Stores,1850 Acacia Dr,Estes Park,CO,80517
sg:fdc79e977cd94773bd09df9c3f219a79,Wheel Bar,Restaurants and Other Eating Places,Full-Service Restaurants,132 E Elkhorn Ave,Estes Park,CO,80517
sg:ae9844cfd12146368a013b856e7ce195,Crossroads Ministry,Religious Organizations,Religious Organizations,851 Dry Gulch Rd,Estes Park,CO,80517
sg:bb4d83c001724206b4c91daf8d143db2,Dairy Queen,Restaurants and Other Eating Places,Limited-Service Restaurants,218 E Elkhorn Ave,Estes Park,CO,80517
sg:4bcfb00d3b314bb2bf2694b7583dcf00,Trailhead Restaurant,Restaurants and Other Eating Places,Full-Service Restaurants,3450 Fall River Rd,Estes Park,CO,80517
sg:b5d62e9b2c4d4abe8e1ea973cc2e0527,Hotel Estes,Traveler Accommodation,Hotels (except Casino Hotels) and Motels,1240 Big Thompson Ave,Estes Park,CO,80517
sg:09e7c871e04e4baca518af291d0c246e,Kind Coffee,Restaurants and Other Eating Places,Snack and Nonalcoholic Beverage Bars,470 E Elkhorn Ave,Estes Park,CO,80517
sg:71ce92b5d855444f98d2133f4face0f7,Aspen Eye Center,Health and Personal Care Stores,Optical Goods Stores,600 S Saint Vrain Ave Unit 5,Estes Park,CO,80517
sg:b90583bbac2b4ecb94f6fbce7f8e6438,Vino Giu,Beverage Manufacturing,Wineries,207 Park Ln,Estes Park,CO,80517
sg:39ecd078337942dda89d1c2da1f1c783,National Park Gateway Stables,Traveler Accommodation,Hotels (except Casino Hotels) and Motels,4600 Fall River Rd,Estes Park,CO,80517
sg:ebe261fd66b34454ab52f76063a9e21b,Spur 66 Liquor,"Beer, Wine, and Liquor Stores","Beer, Wine, and Liquor Stores",900 Moraine Ave,Estes Park,CO,80517
sg:4e8ad8b490084e56a0968c07eb1a04ca,Avant Garde Aleworks,Beverage Manufacturing,Breweries,920 Dunraven St,Estes Park,CO,80517
sg:a46cd78e806044b0b2d3347eac7d892b,Open Air Adventure Park,Amusement Parks and Arcades,Amusement and Theme Parks,490 Prospect Village Dr,Estes Park,CO,80517
sg:c0a5d4ae7a88442e99008a4177f73984,Hollowell Park Trailhead,"Museums, Historical Sites, and Similar Institutions",Nature Parks and Other Similar Institutions,Bear Lake Rd,Estes Park,CO,80517
sg:c47cf907d291474da279ccaa3d883a90,Mary's Lake Lodge,Traveler Accommodation,Hotels (except Casino Hotels) and Motels,2625 Marys Lake Rd,Estes Park,CO,80517
sg:715c377d44434031830d022f817e2e28,Columbine Inn,Traveler Accommodation,Hotels (except Casino Hotels) and Motels,1540 Big Thompson Ave,Estes Park,CO,80517
sg:071c76845b4b49f2bc591b0b3ec8623b,KeyBank,Depository Credit Intermediation,Commercial Banking,541 Big Thompson Ave,Estes Park,CO,80517
sg:52af424d2e724dcf8d77557f0dc58d9b,Rocky Mountain Day Hikes,"Museums, Historical Sites, and Similar Institutions",Nature Parks and Other Similar Institutions,2283 Eagle Cliff Rd,Estes Park,CO,80517
sg:f3129b3e880c4c9f89f12ec1c2e11946,Smokin' Dave's BBQ & Brew Estes Park,Restaurants and Other Eating Places,Full-Service Restaurants,820 Moraine Ave,Estes Park,CO,80517
sg:5692603ecefd48448f0bc48971f770eb,Fun Trax,Other Amusement and Recreation Industries,Golf Courses and Country Clubs,455 Prospector Ln,Estes Park,CO,80517
sg:d07a1a153e55488997eed4ecff5ba8a7,Schrader Oil,Petroleum and Petroleum Products Merchant Wholesalers,Petroleum and Petroleum Products Merchant Wholesalers (except Bulk Stations and Terminals),561 Big Thompson Ave,Estes Park,CO,80517
sg:b03738b535ad40c19a80413f527e62c5,Sinclair Oil,Gasoline Stations,Gasoline Stations with Convenience Stores,1110 Woodstock Dr,Estes Park,CO,80517
sg:3473ed3424af4ee2875e028c62497d49,Elkhorn Lodge & Guest Ranch,Traveler Accommodation,Hotels (except Casino Hotels) and Motels,600 W Elkhorn Ave,Estes Park,CO,80517
sg:7c0caac5c1824b42b75df9c44f10fbdc,Ridgeline Tours,Restaurants and Other Eating Places,Snack and Nonalcoholic Beverage Bars,101 S Saint Vrain Ave,Estes Park,CO,80517
sg:09ad6b0fbe1b4e4b89cd95f785b3f123,Tom Thomas First Colorado Realty,Offices of Real Estate Agents and Brokers,Offices of Real Estate Agents and Brokers,523 Saint Vrain Ln,Estes Park,CO,80517
sg:29d21e4641e540f5ac0609d54f4211a1,Casey's Automotive,Automotive Repair and Maintenance,"Automotive Body, Paint, and Interior Repair and Maintenance",701 Elm Rd,Estes Park,CO,80517
sg:948c12cc5c1f4fc9b7592b9d629e76ab,Hayley's,Restaurants and Other Eating Places,Snack and Nonalcoholic Beverage Bars,102 E Elkhorn Ave,Estes Park,CO,80517
sg:a15e9fa35fee4abf9bdfecffcb707486,StoneBrook Resort,Traveler Accommodation,Hotels (except Casino Hotels) and Motels,1710 Fall River Rd,Estes Park,CO,80517
sg:39f498fb84d045498b1b9aa702f98c42,The Taffy Shop,Specialty Food Stores,Confectionery and Nut Stores,121 W Elkhorn Ave,Estes Park,CO,80517
sg:49a8acf1e11a4b7f9c3d98913c80e11c,Inspired Artisan Market &amp Studio,Building Material and Supplies Dealers,Paint and Wallpaper Stores,157 W Elkhorn Ave Ste 8,Estes Park,CO,80517
sg:a2f87e0442bd439480451e5f793b00cb,Rambo's Longhorn Liquor Mart,"Beer, Wine, and Liquor Stores","Beer, Wine, and Liquor Stores",1640 Big Thompson Ave,Estes Park,CO,80517
sg:f439bb882a8842e79b76156925e96330,Appenzell Inn,Traveler Accommodation,Hotels (except Casino Hotels) and Motels,1100 Big Thompson Ave,Estes Park,CO,80517
sg:88fc70fd02a14dde89730f23ac9f8812,McDonald's,Restaurants and Other Eating Places,Limited-Service Restaurants,501 Big Thompson Ave,Estes Park,CO,80517
sg:560ab62c4c534c1286325ae6fa7b0310,Bear Lake,"Museums, Historical Sites, and Similar Institutions",Nature Parks and Other Similar Institutions,Bear Lake Rd,Estes Park,CO,80517
sg:947f2ff69090418bb75cdcca71e67df2,Riverwalk Park,"Museums, Historical Sites, and Similar Institutions",Nature Parks and Other Similar Institutions,470 E Elkhorn Ave,Estes Park,CO,80517
sg:fdf45db3546c424f89ba802125d87b13,Serenity on the River,Traveler Accommodation,Hotels (except Casino Hotels) and Motels,2222 State Highway 66,Estes Park,CO,80517
sg:b607b00879f046f79ed8ed1f04245d95,Healing Waters Foundation,"Museums, Historical Sites, and Similar Institutions",Nature Parks and Other Similar Institutions,1632 Big Thompson Ave,Estes Park,CO,80517
sg:33006e64f0ab443a8795859f7a53bd55,Estes Park ATV Rental,Motor Vehicle and Motor Vehicle Parts and Supplies Merchant Wholesalers,Automobile and Other Motor Vehicle Merchant Wholesalers,222 E Elkhorn Ave,Estes Park,CO,80517
sg:78dd9b7565ec4595b636db5eb5f35725,Plum Creek Shoe Station,Shoe Stores,Shoe Stores,135 Moraine Ave,Estes Park,CO,80517
sg:8e492d605be947d2a9334ec4c4b86f27,El Mex Kal,Restaurants and Other Eating Places,Full-Service Restaurants,160 1st St,Estes Park,CO,80517
sg:ce44b5d451ef4ed092abaa605738eed7,Estes Park Aerial Tramway,Rail Transportation,Line-Haul Railroads,420 E Riverside Dr,Estes Park,CO,80517
sg:24019aa67f0044b3ac6827f82402dded,Purple Mountain Taffy Company,Specialty Food Stores,Confectionery and Nut Stores,121 E Elkhorn Ave,Estes Park,CO,80517
sg:05e37c15c3c746a9a82e0c6a139593b0,The Egg Of Estes,Restaurants and Other Eating Places,Full-Service Restaurants,393 E Elkhorn Ave,Estes Park,CO,80517
sg:a9e490329dd54f66bb67f4927862810b,Estes Park Dojo,Other Amusement and Recreation Industries,Fitness and Recreational Sports Centers,1755 Co-66,Estes Park,CO,80517
sg:af2262e82c744471ad85daac0c920050,Lithium,Clothing Stores,Women's Clothing Stores,128 E Elkhorn Ave,Estes Park,CO,80517
sg:a32fcc4551934c03ad9afbb0de9d1297,Lula W Dorsey Museum,"Museums, Historical Sites, and Similar Institutions",Museums,2515 Tunnel Rd,Estes Park,CO,80511
sg:c35cbf5190f241b98feee4cccf626f84,La Esmeralda Tamale House,Restaurants and Other Eating Places,Full-Service Restaurants,541 Big Thompson Ave,Estes Park,CO,80517
sg:62d3991de4f54b7e9756667a04c901db,The Baldpate Inn,Traveler Accommodation,Hotels (except Casino Hotels) and Motels,4900 State Hwy 7,Estes Park,CO,80517
sg:dd4e1bc9999241aca493d6d7a25272fe,Mountain Paradise Real Estate,Depository Credit Intermediation,Commercial Banking,255 Park Ln Ste 203,Estes Park,CO,80517
sg:db6af136483e451d8ee525e9ea82ca1a,Christian Church of Estes Park,Religious Organizations,Religious Organizations,4655 US Highway 36,Estes Park,CO,80517
sg:aad0f96f2741415d9610c813ea8a0e11,Unique Colorado Souvenir,"Office Supplies, Stationery, and Gift Stores","Gift, Novelty, and Souvenir Stores",222B E Elkhorn Ave,Estes Park,CO,80517
sg:667ecbcd742846e0a6e7e9ef72dffa68,Mountain Top Preschool And Child Care,Child Day Care Services,Child Day Care Services,1250 Woodstock Dr,Estes Park,CO,80517
sg:cfbb955999504143bf6cacb5461676e3,Red Rose Rock Shop & Museum,"Sporting Goods, Hobby, and Musical Instrument Stores","Hobby, Toy, and Game Stores",490 Moraine Ave,Estes Park,CO,80517
sg:0b1e1d557fc14ba0b7958e3984162373,Elements of Touch Wellness Spa,Personal Care Services,Other Personal Care Services,477 Pine River Ln,Estes Park,CO,80517
sg:887fc6a8c80a498eb51893d59c807fe2,Rocket Fizz,Specialty Food Stores,Confectionery and Nut Stores,356 Elkhorn Avenue #3,Estes Park,CO,80517
sg:fb6795e68f684a179f42c0b171228330,Brynwood On the River,Traveler Accommodation,Hotels (except Casino Hotels) and Motels,710 Moraine Ave,Estes Park,CO,80517
sg:7e05a4d923ac456a896d9c089c411641,Stitchin' Den,Building Material and Supplies Dealers,Paint and Wallpaper Stores,165 Virginia Dr,Estes Park,CO,80517
sg:3b720eae69c644649dc980bc4206f37d,Rocky Mountain Evagelical Free Church,Religious Organizations,Religious Organizations,451 Promontory Dr,Estes Park,CO,80517
sg:f9604532ae4a4bba92d3a405661b37b7,Pine Haven,Traveler Accommodation,Hotels (except Casino Hotels) and Motels,1580 Fall River Rd,Estes Park,CO,80517
sg:86ff60188a054395baf78633d5eb17bc,The Slab,Drinking Places (Alcoholic Beverages),Drinking Places (Alcoholic Beverages),116 E Elkhorn Ave,Estes Park,CO,80517
sg:ee019800060d4cc2a7cd6997ec117722,Bockelmann Family Chiropractic,Offices of Other Health Practitioners,Offices of Chiropractors,521 S Saint Vrain Ave,Estes Park,CO,80517
sg:bcc389613c374e9696eaa3a65052bb72,Performance Park,"Museums, Historical Sites, and Similar Institutions",Nature Parks and Other Similar Institutions,Performance Park,Estes Park,CO,80517
sg:30887a83732c40a48f20af6969c7bd2e,Raven's Roast Coffee Lounge,Restaurants and Other Eating Places,Snack and Nonalcoholic Beverage Bars,157 W Elkhorn Ave,Estes Park,CO,80517
sg:a83561d5e4984845b81c2dcfa98c3b41,Rocky Mountain Tops,Clothing Stores,Women's Clothing Stores,101 E Elkhorn Ave,Estes Park,CO,80517
sg:e5f867de3d81415b8c0fa0d4f2a35074,The Grubsteak Restaurant,Restaurants and Other Eating Places,Full-Service Restaurants,134 W Elkhorn Ave,Estes Park,CO,80517
sg:bcfcf1191182429ba1704d2159e2d0cb,Taharaa Mountain Lodge,Traveler Accommodation,Hotels (except Casino Hotels) and Motels,3110 S St Vrain Ave,Estes Park,CO,80517
sg:ed9bd3141cae48dbb57a650af3ce9895,April Allen RE MAX Mountain Brokers,Offices of Real Estate Agents and Brokers,Offices of Real Estate Agents and Brokers,1200 Graves Ave,Estes Park,CO,80517
sg:d70a34763ca643a592b569ae7c85a78c,Alpenglow Images &amp Accents,Other Miscellaneous Store Retailers,Art Dealers,145 E Elkhorn Ave,Estes Park,CO,80517
sg:94fbc39e9daf49778cab36d93ca754d5,Seventh Day Adventist Church,Religious Organizations,Religious Organizations,Valley Rd & W Elkhor,Estes Park,CO,80517
sg:707afccff1a64b0fad1548e0a8e3166d,Blue Door,Traveler Accommodation,Hotels (except Casino Hotels) and Motels,1220 Big Thompson Ave,Estes Park,CO,80517
sg:c82bd1545cfd440dad0a66aaff8aded1,Lithium,Clothing Stores,Women's Clothing Stores,204 W Elkhorn Ave,Estes Park,CO,80517
sg:61a40ce679594fee9c951fb2c7de9e06,Castle Mountain Lodge,Traveler Accommodation,Hotels (except Casino Hotels) and Motels,1520 Fall River Rd,Estes Park,CO,80517
sg:bfdebe1624804cd9a1a41ba0dbd78af6,Estes Park Visitors Center,"General Merchandise Stores, including Warehouse Clubs and Supercenters",All Other General Merchandise Stores,500 Big Thompson Ave,Estes Park,CO,80517
sg:ea002c0392234139917aae9354980a2a,C T M Automotive Repair,"Automotive Parts, Accessories, and Tire Stores",Automotive Parts and Accessories Stores,911 Dunraven St,Estes Park,CO,80517
sg:edea51df89364fa3bd2625384dd6ced9,Fire Mountain Programs,Home Health Care Services,Home Health Care Services,5532 US Highway 36,Estes Park,CO,80517
sg:3dd1c60c60b946689ae3ff5260182e66,Wear Me Out T's,"Office Supplies, Stationery, and Gift Stores","Gift, Novelty, and Souvenir Stores",157 E Elkhorn Ave,Estes Park,CO,80517
sg:e04bab3553f4405097500b17d7f7b4f5,Insurance Associates Inc,"Agencies, Brokerages, and Other Insurance Related Activities",Insurance Agencies and Brokerages,363 E Elkhorn Ave,Estes Park,CO,80517
sg:95aa08b29da14e63b50827946ab3fcf2,Ez Auto Wash,Gasoline Stations,Gasoline Stations with Convenience Stores,534 S Saint Vrain Ave,Estes Park,CO,80517
sg:f4a83c5d6ce54edb843a2682ccdcae71,Confluence Park,"Museums, Historical Sites, and Similar Institutions",Nature Parks and Other Similar Institutions,Rockwell St & Riverside Dr,Estes Park,CO,80517
sg:99d179d0008d443f986be0f228caf603,Affinity Massage and Wellness Center,Personal Care Services,Other Personal Care Services,1182 Graves Ave Unit C,Estes Park,CO,80517
sg:db8ca1f17ce245afae3b964e9df0b46d,Green Jeep Tour,Restaurants and Other Eating Places,Snack and Nonalcoholic Beverage Bars,157 Moraine Ave,Estes Park,CO,80517
sg:ead1e6c7496444c9b6ba60c4d5745a7b,Summit View Restaurant,Restaurants and Other Eating Places,Full-Service Restaurants,6120 State Highway 7,Estes Park,CO,80517
sg:7221e12de7f84c2182ba1d032639bddc,Maria Gomez RE MAX MOUNTAIN BROKERS,Offices of Real Estate Agents and Brokers,Offices of Real Estate Agents and Brokers,1200 Graves Ave,Estes Park,CO,80517
sg:712d6c72e5c34d85b66fdbff78750d59,Aspen Dental Center,Offices of Dentists,Offices of Dentists,600 S Saint Vrain Ave Unit 3,Estes Park,CO,80517
sg:254a9c628449429e9be6bb0b91c9e22e,Cinnamon's Bakery,Restaurants and Other Eating Places,Snack and Nonalcoholic Beverage Bars,920 W Elkhorn Ave,Estes Park,CO,80517
sg:203707f792624f079d2b116d9e2a4425,The Rustic Acre,Traveler Accommodation,Hotels (except Casino Hotels) and Motels,650 S Saint Vrain Ave,Estes Park,CO,80517
sg:a6444a9514e342f49bfca5f5715937be,Pati's Hair Care Best Little Hair House In Estes,Personal Care Services,Beauty Salons,455 W Elkhorn Ave,Estes Park,CO,80517
sg:edb5b6c0afb5426185f3d7f55651e2d6,Affordable Tree Service FNL,Building Material and Supplies Dealers,Hardware Stores,3104 Carriage Dr,Estes Park,CO,80517
sg:35238802070f4b5eb2cca7c5f7a123e1,Dermody Village Barber Shop,Personal Care Services,Beauty Salons,151 Virginia Dr,Estes Park,CO,80517
sg:2d9a0be53b184b638e4ce38407e6ea17,Accel Computer Services,Health and Personal Care Stores,Food (Health) Supplement Stores,790 Castle Mountain Rd,Estes Park,CO,80517
sg:fdcd511cbcd546d1b26485cb97c37985,Images of Estes Park,"Other Professional, Scientific, and Technical Services","Photography Studios, Portrait",181 Riverside Dr,Estes Park,CO,80517
sg:f8e6603ca8ea4f94a1654b06b8e59476,Fish Jeff Vet,"Other Professional, Scientific, and Technical Services",Veterinary Services,1260 Manford Ave,Estes Park,CO,80517
sg:19fc65d966eb4db188e71d2f2763f581,Autoworks,Automotive Repair and Maintenance,General Automotive Repair,910 Dunraven St,Estes Park,CO,80517
sg:903b68ae83974c3bb906589391cf7150,The Mystic Mustang Tattoo Studio,Personal Care Services,Other Personal Care Services,222 East Elkhorn Ave Ste C,Estes Park,CO,80517
sg:200f99a8f3ec4aceaa99f3eb535df9f2,Trout Haven Fishing Pond,Other Motor Vehicle Dealers,Boat Dealers,810 Moraine Ave,Estes Park,CO,80517
sg:feba3a9b44964adba53b76073975d4f2,Summit Church,Religious Organizations,Religious Organizations,600 S Saint Vrain Ave Unit 1,Estes Park,CO,80517
sg:ae3763d376d94a5ea5fd186b45bc0ff9,Rocky Mountain National Park,"Museums, Historical Sites, and Similar Institutions",Nature Parks and Other Similar Institutions,203 Park Ln,Estes Park,CO,80517
sg:84a85c196fee4368a4b7bf49f6e0db45,Peak to Peak Scenic Byway,"Museums, Historical Sites, and Similar Institutions",Nature Parks and Other Similar Institutions,645 Co-7,Estes Park,CO,80517
sg:15ecd9990a0841b9a28e37e5af8db7bc,The Wild Rose Food & Spirits,Restaurants and Other Eating Places,Full-Service Restaurants,157 W Elkhorn Ave,Estes Park,CO,80517
sg:50b15aa0076142029143666a6b72eade,The View,Restaurants and Other Eating Places,Full-Service Restaurants,300 Riverside Dr,Estes Park,CO,80517
sg:6ce672c75a1b460c9216ee62db77a279,Caramel Corn,Specialty Food Stores,Confectionery and Nut Stores,144 E Elkhorn Ave,Estes Park,CO,80517
sg:185b93c6ae1140eca74cafd1f340f06a,Two Blondes and A Salon,Personal Care Services,Beauty Salons,541 Lone Pine Dr,Estes Park,CO,80517
sg:04e7ad14e4294fc5a8645c80db27d572,Thirty Below Leather,Other Leather and Allied Product Manufacturing,Women's Handbag and Purse Manufacturing,356 E Elkhorn Ave,Estes Park,CO,80517
sg:be4cd1494af445359ec9ed095ca8dcf8,The Farmhouse Market,"Sporting Goods, Hobby, and Musical Instrument Stores","Sewing, Needlework, and Piece Goods Stores",423 W Elkhorn Ave,Estes Park,CO,80517
sg:ef3d4b389d5d4425bbe5df54694f6e70,The Enchanted Florist,Florists,Florists,162 S Saint Vrain Ave,Estes Park,CO,80517
sg:b40fd90722e842d1bfaa218205ae134d,Aspen Lodge Resort & Spa,Traveler Accommodation,Hotels (except Casino Hotels) and Motels,6120 State Highway 7,Estes Park,CO,80517
sg:91fc6b87ca944a95830821fd061e2b60,Moose Creek,Clothing Stores,Women's Clothing Stores,125 Moraine Ave,Estes Park,CO,80517
sg:a306a62eaaca474d8b13357c0b874f10,Jesse Lynne Designs,Personal Care Services,Nail Salons,178 S Saint Vrain Ave,Estes Park,CO,80517
sg:777c2d5a50da41459eb929d02c477479,Nepal's Cafe,Restaurants and Other Eating Places,Full-Service Restaurants,184 E Elkhorn Ave Unit H,Estes Park,CO,80517
sg:c500dd40f53f493fb9a34457410a8495,Beaver Brook On The River,Traveler Accommodation,Hotels (except Casino Hotels) and Motels,1700 State Highway 66,Estes Park,CO,80517
sg:0fbbd651648c4f248c8a1c8e839fdfcc,National Park Village South,Lessors of Real Estate,Malls,900 Moraine Ave,Estes Park,CO,80517
sg:bbf2c8cfd0aa4a8c920c42085cd4d47a,Amberwood,Traveler Accommodation,Hotels (except Casino Hotels) and Motels,1889 Fall River Rd,Estes Park,CO,80517
sg:81cec7b31e6d4e26bc4bd153b0605d27,Lonigan's,Restaurants and Other Eating Places,Full-Service Restaurants,110 W Elkhorn Ave,Estes Park,CO,80517
sg:31de4c7f05ed42f9baaf01e08229b907,Seeing Hands Massage,Personal Care Services,Other Personal Care Services,157 W Elkhorn Ste 15 A,Estes Park,CO,80517
sg:57793d83397b414f868a12bbf2cf03ea,Today's Nail,Personal Care Services,Nail Salons,464 Riverside Dr,Estes Park,CO,80517
sg:7b260149fe4f4e179d5e43264d41ceb4,Coffee on the Rocks,Restaurants and Other Eating Places,Snack and Nonalcoholic Beverage Bars,510 Moraine Ave,Estes Park,CO,80517
sg:3002035e2042473a8ffab9b9c8d43e1e,Spencer Family Chiropractic,Offices of Other Health Practitioners,Offices of Chiropractors,521 S Saint Vrain Ave Unit B,Estes Park,CO,80517
sg:55888b557d0847aa86f455c63b0b8693,Penelope's Old Time Burgers,Restaurants and Other Eating Places,Full-Service Restaurants,229 W Elkhorn Ave,Estes Park,CO,80517
sg:5d39435ddcab4700b8f1442008072382,Estes Park KOA Campground,RV (Recreational Vehicle) Parks and Recreational Camps,RV (Recreational Vehicle) Parks and Campgrounds,2051 Big Thompson Ave,Estes Park,CO,80517
sg:deb3dec6a2ae44b789b378bffa4727c5,Rocky Mountain Hotel & Conference Center,Traveler Accommodation,Hotels (except Casino Hotels) and Motels,1701 N Lake Ave,Estes Park,CO,80517
sg:2b1837a7051f48a8a20ebdb624862972,The Grey House,Clothing Stores,Women's Clothing Stores,130A E Elkhorn Ave,Estes Park,CO,80517
sg:287ea662494c465f8448e5443a71f7be,Estes Park Mountain Shop,"Sporting Goods, Hobby, and Musical Instrument Stores",Sporting Goods Stores,2050 Big Thompson Ave,Estes Park,CO,80517
sg:af0f9b6a413542bd8b881049f8d69708,Della Terra Mountain Chateau,Traveler Accommodation,Hotels (except Casino Hotels) and Motels,3501 Fall River Rd,Estes Park,CO,80517
sg:44cd9fb6bb7f47d3a3be43192e82f41b,Murphy's Resort,Traveler Accommodation,Hotels (except Casino Hotels) and Motels,1650 Big Thompson Ave,Estes Park,CO,80517
sg:67a50b7e45ca492aad7ac103be1774cf,MedX of Estes Park,Other Amusement and Recreation Industries,Fitness and Recreational Sports Centers,158 1st St,Estes Park,CO,80517
sg:e4b0e53e57ca4a90953868b3ddd34eab,Ensignal Verizon Wireless Premium Retailer,Wired and Wireless Telecommunications Carriers,Wireless Telecommunications Carriers (except Satellite),509 Big Thompson Ave Unit 1 Bldg F,Estes Park,CO,80517
sg:6b7e77f7b10f4276aaf40803760e2406,The Barrel Estes Park,"Beer, Wine, and Liquor Stores","Beer, Wine, and Liquor Stores",251 Moraine Ave,Estes Park,CO,80517
sg:2ffaccbfec80495b9f50f3a57d88fe2c,Flavors of the Rockies,Restaurants and Other Eating Places,Snack and Nonalcoholic Beverage Bars,101 W Elkhorn Ave Unit B,Estes Park,CO,80517
sg:fc5ea7d7d29c4034a7f43a0a4595c926,Community Hearing Center,Medical and Diagnostic Laboratories,Medical Laboratories,1186 Graves Ave Unit B,Estes Park,CO,80517
sg:239cc64c5b764ac38f645db2e89855d9,Cascades Restaurant & Lounge,Restaurants and Other Eating Places,Full-Service Restaurants,333 E Wonder View Ave,Estes Park,CO,80517
sg:3025d5b1c73e49cea118bf8138dcb5f8,Cafe at Trail Ridge,Restaurants and Other Eating Places,Full-Service Restaurants,945 Moraine Ave,Estes Park,CO,80517
sg:f320b6d31f6345da87c01e8c3f792650,Estes Park Community Thrift Shop,Used Merchandise Stores,Used Merchandise Stores,1000 Big Thompson Ave,Estes Park,CO,80517
sg:40384f77700f4542b8b3071cb33762fc,The Lazy Moose,Clothing Stores,Women's Clothing Stores,140 E Elkhorn Ave,Estes Park,CO,80517
sg:9313b122df6548b6a3fbbba275cb75c9,Donut Haus,Restaurants and Other Eating Places,Snack and Nonalcoholic Beverage Bars,342 Moraine Ave,Estes Park,CO,80517
sg:6c12b91411c34ab5bc8b8b17e74dfd36,IN Self Storage,Lessors of Real Estate,Lessors of Miniwarehouses and Self-Storage Units,1210 Woodstock Dr,Estes Park,CO,80517
sg:a6016580eb9d4cfd845dbbfcd81f8fd0,Estes Park Resort,Traveler Accommodation,Hotels (except Casino Hotels) and Motels,1700 Big Thompson Ave,Estes Park,CO,80517
sg:b4a090f05d2f4d7b8450c3277f951b3c,Miller's Indian Village Trading Post,Clothing Stores,Women's Clothing Stores,100 W Elkhorn Ave,Estes Park,CO,80517
sg:80ab8452cd834594ac465e666f0c7b19,Yesterday's Ice Cream Shoppe,Restaurants and Other Eating Places,Snack and Nonalcoholic Beverage Bars,191 W. Elkhorn Ave,Estes Park,CO,80517
